{
    "schemaVersion":  1,
    "id":  "fan_cat_head",
    "sourceId":  3,
    "designerName":  "고양이 인형",
    "designerNote":  "머리 위에 고양이를 업고 다닐 수 있음",
    "enabled":  true,
    "localization":  {
                         "name":  "",
                         "description":  ""
                     },
    "presentation":  {
                         "sprite":  ""
                     },
    "rarity":  "white",
    "tags":  [
                 "passive"
             ],
    "effects":  [
                    {
                        "trigger":  {
                                        "event":  "passive"
                                    },
                        "target":  {
                                       "key":  "cosmetic"
                                   },
                        "operation":  "modify_value",
                        "mode":  "add",
                        "amount":  0,
                        "options":  "Cat"
                    }
                ]
}
