{
    "schemaVersion":  1,
    "id":  "fan_number_applepie",
    "sourceId":  56,
    "designerName":  "사과파이",
    "designerNote":  "적의 5보다 큰 숫자가 모두 5로 취급됨",
    "enabled":  true,
    "localization":  {
                         "name":  "",
                         "description":  ""
                     },
    "presentation":  {
                         "sprite":  ""
                     },
    "rarity":  "blue",
    "tags":  [
                 "passive"
             ],
    "effects":  [
                    {
                        "trigger":  {
                                        "event":  "passive"
                                    },
                        "target":  {
                                       "key":  "monster_number"
                                   },
                        "operation":  "digit_max",
                        "mode":  "digit_max",
                        "amount":  5.0
                    }
                ]
}
