{
    "schemaVersion":  1,
    "id":  "fan_start_paperfrog",
    "sourceId":  22,
    "designerName":  "종이개구리",
    "designerNote":  "첫 턴동안 적의 힘 -1",
    "enabled":  true,
    "localization":  {
                         "name":  "",
                         "description":  ""
                     },
    "presentation":  {
                         "sprite":  ""
                     },
    "rarity":  "white",
    "tags":  [
                 "battle_start"
             ],
    "effects":  [
                    {
                        "trigger":  {
                                        "event":  "battle_start"
                                    },
                        "target":  {
                                       "actor":  "monster",
                                       "stat":  "strength"
                                   },
                        "operation":  "modify_value",
                        "mode":  "add",
                        "amount":  -1.0,
                        "duration":  {
                                         "turns":  1,
                                         "decreaseAt":  "turn_end"
                                     }
                    }
                ]
}
