{
    "schemaVersion":  1,
    "id":  "fan_damage_anchor",
    "sourceId":  15,
    "designerName":  "닻",
    "designerNote":  "피해를 입을 때마다 항상 20씩 적게 받음",
    "enabled":  true,
    "localization":  {
                         "name":  "",
                         "description":  ""
                     },
    "presentation":  {
                         "sprite":  ""
                     },
    "rarity":  "white",
    "tags":  [
                 "take_damage"
             ],
    "effects":  [
                    {
                        "trigger":  {
                                        "event":  "take_damage"
                                    },
                        "target":  {
                                       "value":  "incoming_damage"
                                   },
                        "operation":  "modify_value",
                        "mode":  "add",
                        "amount":  -20.0
                    }
                ]
}
